{
  "schema_version": "1.0",
  "request_id": "example-pip-resolve",
  "trace_id": "example-pip-resolve-trace",
  "command": "resolve",
  "ecosystem": "pip",
  "package": {
    "name": "requests",
    "version": "2.32.5"
  },
  "options": {
    "format": "graph",
    "timeout_ms": 60000,
    "return_raw": false
  },
  "context": {
    "caller": "example"
  }
}
